{
  "goal": "Toy goal for task-007: create README with required content",
  "scope": [
    "README.md"
  ],
  "out_of_scope": [
    "everything else"
  ],
  "acceptance_criteria": [
    {
      "id": "AC-1",
      "type": "executable",
      "check": "test -f workdir/README.md",
      "expected": "exit 0"
    },
    {
      "id": "AC-2",
      "type": "judgment",
      "check": "Is the README understandable to a newcomer?"
    }
  ]
}
