{
  "goal": "Create a simple Python module (hello.py) that prints 'hello world' and write a pytest test suite (test_hello.py) to verify its functionality.",
  "scope": [
    "Create hello.py that prints 'hello world' to stdout",
    "Create test_hello.py containing pytest tests that import and verify hello.py",
    "Ensure all pytest tests pass"
  ],
  "out_of_scope": [
    "Setting up project-wide configuration or virtual environment",
    "Adding documentation or docstrings",
    "Building or distributing the module",
    "Adding CI/CD pipelines"
  ],
  "acceptance_criteria": [
    {
      "id": "AC-1",
      "type": "executable",
      "check": "python3 hello.py | grep -q 'hello world'",
      "expected": "hello.py exists and prints 'hello world'"
    },
    {
      "id": "AC-2",
      "type": "executable",
      "check": "python3 -c \"import sys; sys.path.insert(0, '.'); import hello\"",
      "expected": "hello.py exists and is importable as a valid Python module"
    },
    {
      "id": "AC-3",
      "type": "executable",
      "check": "python3 -m pytest test_hello.py -v",
      "expected": "test_hello.py exists and all pytest tests pass"
    },
    {
      "id": "AC-4",
      "type": "judgment",
      "check": "Does test_hello.py import hello.py and test its behavior?",
      "expected": "Test file properly imports the module and validates its output"
    }
  ],
  "flags": []
}
