{
  "goal": "Create a Python hello module that prints 'hello world' and write automated pytest tests to verify its functionality",
  "scope": [
    "Create hello.py module with code that prints 'hello world'",
    "Create test_hello.py with pytest test cases that import and validate hello.py",
    "Ensure pytest tests pass successfully"
  ],
  "out_of_scope": [
    "Documentation or README files",
    "CI/CD pipeline integration",
    "Package distribution or setup.py",
    "Additional features beyond printing 'hello world'"
  ],
  "acceptance_criteria": [
    {
      "id": "AC-1",
      "type": "executable",
      "check": "python hello.py",
      "expected": "Output contains 'hello world'"
    },
    {
      "id": "AC-2",
      "type": "executable",
      "check": "pytest test_hello.py -v",
      "expected": "All tests pass with exit code 0"
    },
    {
      "id": "AC-3",
      "type": "judgment",
      "check": "Does test_hello.py import hello.py and validate its functionality?"
    }
  ],
  "flags": []
}
