{
  "goal": "Fix the off-by-one bug in stats.py where mean() divides by len(numbers)+1 instead of len(numbers), causing all downstream functions (variance, stdev, normalize) to produce incorrect results and all tests to fail.",
  "scope": [
    "stats.py \u2014 fix the denominator in the mean() function from len(numbers)+1 to len(numbers)"
  ],
  "out_of_scope": [
    "test_stats.py \u2014 must not be modified",
    "Any refactoring or feature additions beyond the single bug fix"
  ],
  "acceptance_criteria": [
    {
      "id": "AC-1",
      "type": "executable",
      "check": "cd /Users/George/warden/tasks/t-nohint/workdir && python3 -m pytest test_stats.py -v"
    },
    {
      "id": "AC-2",
      "type": "judgment",
      "check": "Does stats.py compute the arithmetic mean by dividing by len(numbers) (not len(numbers)+1)?"
    }
  ]
}
